{
  "name": "preset_CN",
  "description": "Preset f√ºr Land CN",
  "version": "1.0",
  "indicator_snapshot": {
    "FI_RES_TOTL_MO": {
      "value": 11.2291372513816,
      "year": "2024",
      "source": "WB",
      "indicator": "FI.RES.TOTL.MO",
      "country_currency": null,
      "country_timezone": null
    },
    "NE_IMP_GNFS_CD": {
      "value": 3219342570126.17,
      "year": "2024",
      "source": "WB",
      "indicator": "NE.IMP.GNFS.CD",
      "country_currency": null,
      "country_timezone": null,
      "monthly_imports_usd": 268278547510.51416
    },
    "DT_DOD_DECT_GN_ZS": {
      "value": 13.0007522555005,
      "year": "2024",
      "source": "WB",
      "indicator": "DT.DOD.DECT.GN.ZS",
      "country_currency": null,
      "country_timezone": null
    },
    "NY_GDP_MKTP_CD": {
      "value": 18743803170827.2,
      "year": "2024",
      "source": "WB",
      "indicator": "NY.GDP.MKTP.CD",
      "country_currency": null,
      "country_timezone": null,
      "monthly_gdp_usd": 1561983597568.9333
    },
    "FP_CPI_TOTL_ZG": {
      "value": 0.218128938439177,
      "year": "2024",
      "source": "WB",
      "indicator": "FP.CPI.TOTL.ZG",
      "country_currency": null,
      "country_timezone": null,
      "latest_annual_change": 0.218128938439177
    },
    "NE_EXP_GNFS_CD": {
      "value": 3753056083349.04,
      "year": "2024",
      "source": "WB",
      "indicator": "NE.EXP.GNFS.CD",
      "country_currency": null,
      "country_timezone": null,
      "monthly_exports_usd": 312754673612.42
    },
    "BX_KLT_DINV_CD_WD": {
      "value": 18556141172.84,
      "year": "2024",
      "source": "WB",
      "indicator": "BX.KLT.DINV.CD.WD",
      "country_currency": null,
      "country_timezone": null,
      "monthly_fdi_net_usd": 1546345097.7366667
    },
    "GC_XPN_TOTL_GD_ZS": {
      "value": null,
      "year": null,
      "source": "WB_empty",
      "indicator": "GC.XPN.TOTL.GD.ZS",
      "note": "no_values"
    }
  },
  "metadata": {
    "created_by": "auto-generator",
    "created_at": "2025-12-26T14:49:48.280135+00:00",
    "country_info": {
      "alpha2": "CN",
      "alpha3": "CHN",
      "numeric": null,
      "country_de": "China",
      "country_en": "China",
      "timezone": null,
      "currency": null
    }
  }
}