{
  "name": "preset_BR",
  "description": "Preset f√ºr Land BR",
  "version": "1.0",
  "indicator_snapshot": {
    "FI_RES_TOTL": {
      "value": null,
      "year": null,
      "source": "missing",
      "indicator": "FI.RES.TOTL",
      "note": "invalid_indicator"
    },
    "NE_IMP_GNFS_CD": {
      "value": 385708875013.773,
      "year": "2024",
      "source": "WB",
      "indicator": "NE.IMP.GNFS.CD",
      "monthly_imports_usd": 32142406251.14775
    },
    "DT_DOD_DECT_GN_ZS": {
      "value": 28.6612661075538,
      "year": "2024",
      "source": "WB",
      "indicator": "DT.DOD.DECT.GN.ZS"
    }
  },
  "metadata": {
    "created_by": "auto-generator",
    "created_at": "2025-12-23T07:01:31.654180Z"
  }
}