{
  "name": "preset_GB",
  "description": "Preset für Land GB",
  "version": "1.0",
  "indicator_snapshot": {
    "FI_RES_TOTL": {
      "value": null,
      "year": null,
      "source": "missing",
      "indicator": "FI.RES.TOTL",
      "note": "invalid_indicator"
    },
    "NE_IMP_GNFS_CD": {
      "value": 1174222748816.76,
      "year": "2024",
      "source": "WB",
      "indicator": "NE.IMP.GNFS.CD",
      "country_currency": "GBP",
      "country_timezone": "Europe/London",
      "monthly_imports_usd": 97851895734.73
    },
    "DT_DOD_DECT_GN_ZS": {
      "value": null,
      "year": null,
      "source": "WB_empty",
      "indicator": "DT.DOD.DECT.GN.ZS",
      "note": "no_values"
    },
    "NY_GDP_MKTP_CD": {
      "value": 3686033044482.13,
      "year": "2024",
      "source": "WB",
      "indicator": "NY.GDP.MKTP.CD",
      "country_currency": "GBP",
      "country_timezone": "Europe/London",
      "monthly_gdp_usd": 307169420373.5108
    },
    "FP_CPI_TOTL_ZG": {
      "value": 3.2715729463592,
      "year": "2024",
      "source": "WB",
      "indicator": "FP.CPI.TOTL.ZG",
      "country_currency": "GBP",
      "country_timezone": "Europe/London",
      "latest_annual_change": 3.2715729463592
    },
    "NE_EXP_GNFS_CD": {
      "value": 1142086333403.45,
      "year": "2024",
      "source": "WB",
      "indicator": "NE.EXP.GNFS.CD",
      "country_currency": "GBP",
      "country_timezone": "Europe/London",
      "monthly_exports_usd": 95173861116.95416
    },
    "BX_KLT_DINV_CD_WD": {
      "value": -60647281077.0004,
      "year": "2024",
      "source": "WB",
      "indicator": "BX.KLT.DINV.CD.WD",
      "country_currency": "GBP",
      "country_timezone": "Europe/London",
      "monthly_fdi_net_usd": -5053940089.750033
    },
    "GC_XPN_TOTL_GD_ZS": {
      "value": 41.2292290721047,
      "year": "2023",
      "source": "WB",
      "indicator": "GC.XPN.TOTL.GD.ZS",
      "country_currency": "GBP",
      "country_timezone": "Europe/London",
      "latest_annual_change": 41.2292290721047
    }
  },
  "metadata": {
    "created_by": "auto-generator",
    "created_at": "2025-12-24T07:37:11.124708+00:00",
    "country_info": {
      "alpha2": "GB",
      "alpha3": "GBR",
      "numeric": "826",
      "country_de": "Vereinigtes Königreich",
      "country_en": "United Kingdom",
      "timezone": "Europe/London",
      "currency": "GBP"
    }
  }
}