{
  "name": "preset_US",
  "description": "Preset f√ºr Land US",
  "version": "1.0",
  "indicator_snapshot": {
    "FI_RES_TOTL_MO": {
      "value": 1.94032058064747,
      "year": "2024",
      "source": "WB",
      "indicator": "FI.RES.TOTL.MO",
      "country_currency": null,
      "country_timezone": null
    },
    "NE_IMP_GNFS_CD": {
      "value": 4103100000000,
      "year": "2024",
      "source": "WB",
      "indicator": "NE.IMP.GNFS.CD",
      "country_currency": null,
      "country_timezone": null,
      "monthly_imports_usd": 341925000000.0
    },
    "DT_DOD_DECT_GN_ZS": {
      "value": null,
      "year": null,
      "source": "WB_empty",
      "indicator": "DT.DOD.DECT.GN.ZS",
      "note": "no_values"
    },
    "NY_GDP_MKTP_CD": {
      "value": 28750956130731.2,
      "year": "2024",
      "source": "WB",
      "indicator": "NY.GDP.MKTP.CD",
      "country_currency": null,
      "country_timezone": null,
      "monthly_gdp_usd": 2395913010894.2666
    },
    "FP_CPI_TOTL_ZG": {
      "value": 2.94952520485207,
      "year": "2024",
      "source": "WB",
      "indicator": "FP.CPI.TOTL.ZG",
      "country_currency": null,
      "country_timezone": null,
      "latest_annual_change": 2.94952520485207
    },
    "NE_EXP_GNFS_CD": {
      "value": 3193500000000,
      "year": "2024",
      "source": "WB",
      "indicator": "NE.EXP.GNFS.CD",
      "country_currency": null,
      "country_timezone": null,
      "monthly_exports_usd": 266125000000.0
    },
    "BX_KLT_DINV_CD_WD": {
      "value": 297058000000,
      "year": "2024",
      "source": "WB",
      "indicator": "BX.KLT.DINV.CD.WD",
      "country_currency": null,
      "country_timezone": null,
      "monthly_fdi_net_usd": 24754833333.333332
    },
    "GC_XPN_TOTL_GD_ZS": {
      "value": 24.8982825568771,
      "year": "2023",
      "source": "WB",
      "indicator": "GC.XPN.TOTL.GD.ZS",
      "country_currency": null,
      "country_timezone": null,
      "latest_annual_change": 24.8982825568771
    }
  },
  "metadata": {
    "created_by": "auto-generator",
    "created_at": "2025-12-26T14:49:49.472286+00:00",
    "country_info": {
      "alpha2": "US",
      "alpha3": "USA",
      "numeric": null,
      "country_de": "Vereinigte Staaten",
      "country_en": "United States",
      "timezone": null,
      "currency": null
    }
  }
}