{
  "name": "preset_GR",
  "description": "Preset f√ºr Land GR",
  "version": "1.0",
  "indicator_snapshot": {
    "FI_RES_TOTL_MO": {
      "value": 1.29465956102193,
      "year": "2024",
      "source": "WB",
      "indicator": "FI.RES.TOTL.MO"
    },
    "NE_IMP_GNFS_CD": {
      "value": 122135634583.353,
      "year": "2024",
      "source": "WB",
      "indicator": "NE.IMP.GNFS.CD",
      "monthly_imports_usd": 10177969548.61275
    },
    "DT_DOD_DECT_CD": {
      "value": null,
      "year": null,
      "source": "WB_empty",
      "indicator": "DT.DOD.DECT.CD",
      "note": "no_values"
    },
    "NY_GDP_MKTP_CD": {
      "value": 256238371778.118,
      "year": "2024",
      "source": "WB",
      "indicator": "NY.GDP.MKTP.CD",
      "monthly_gdp_usd": 21353197648.176502
    },
    "FP_CPI_TOTL_ZG": {
      "value": 2.74149045788606,
      "year": "2024",
      "source": "WB",
      "indicator": "FP.CPI.TOTL.ZG",
      "latest_annual_change": 2.74149045788606
    },
    "NE_EXP_GNFS_CD": {
      "value": 107906278860.86,
      "year": "2024",
      "source": "WB",
      "indicator": "NE.EXP.GNFS.CD",
      "monthly_exports_usd": 8992189905.071667
    },
    "BX_KLT_DINV_CD_WD": {
      "value": 6742277267.34835,
      "year": "2024",
      "source": "WB",
      "indicator": "BX.KLT.DINV.CD.WD",
      "monthly_fdi_net_usd": 561856438.9456958
    },
    "GC_XPN_TOTL_GD_ZS": {
      "value": 47.3019610078935,
      "year": "2023",
      "source": "WB",
      "indicator": "GC.XPN.TOTL.GD.ZS",
      "latest_annual_change": 47.3019610078935
    }
  },
  "metadata": {
    "created_by": "auto-generator",
    "created_at": "2025-12-28T05:23:05.202834+00:00",
    "country_info": {
      "alpha2": "GR",
      "alpha3": null,
      "numeric": null,
      "country_de": null,
      "country_en": null,
      "timezone": null,
      "currency": null
    }
  }
}